{
  "causes": {
    "alternator_failing": "demarrage_charge",
    "amortisseur_use": "suspension",
    "ampoule_grillee": "eclairage",
    "battery_dead": "demarrage_charge",
    "battery_terminals_corroded": "demarrage_charge",
    "biellette_direction_usee": "direction",
    "bobine_allumage_hs": "injection",
    "boite_vitesses_usee": "transmission",
    "brake_caliper_seized": "freinage",
    "brake_disc_warped": "freinage",
    "brake_fluid_low": "freinage",
    "brake_pads_worn": "freinage",
    "brake_slide_pins_dry": "freinage",
    "butee_embrayage_hs": "embrayage",
    "cardan_use": "transmission",
    "catalyseur_colmate": "echappement",
    "compresseur_clim_hs": "climatisation",
    "condenseur_clim_bouche": "climatisation",
    "coolant_level_low": "refroidissement",
    "cooling_fan_failure": "refroidissement",
    "coupelle_amortisseur_hs": "suspension",
    "courroie_accessoires_usee": "distribution",
    "courroie_distribution_usee": "distribution",
    "cremaillere_usee": "direction",
    "deshydrateur_sature": "climatisation",
    "disque_embrayage_use": "embrayage",
    "emetteur_recepteur_defaillant": "embrayage",
    "feu_arriere_defaillant": "eclairage",
    "feu_avant_defaillant": "eclairage",
    "filtre_air_colmate": "filtration",
    "filtre_carburant_colmate": "filtration",
    "filtre_carburant_injection": "injection",
    "filtre_habitacle_clim": "climatisation",
    "filtre_habitacle_sature": "filtration",
    "filtre_huile_colmate": "filtration",
    "fuite_gaz_refrigerant": "climatisation",
    "galet_tendeur_defaillant": "distribution",
    "glow_plugs_failing": "demarrage_charge",
    "ground_cable_corroded": "demarrage_charge",
    "injecteur_encrasse": "injection",
    "joint_collecteur_hs": "echappement",
    "parasitic_drain": "demarrage_charge",
    "pompe_direction_hs": "direction",
    "pompe_eau_distribution": "distribution",
    "pompe_injection_hs": "injection",
    "radiator_clogged": "refroidissement",
    "ressort_casse": "suspension",
    "rotule_direction_usee": "direction",
    "rotule_suspension_hs": "suspension",
    "silencieux_perce": "echappement",
    "silentbloc_use": "suspension",
    "sonde_lambda_hs": "echappement",
    "soufflet_cardan_dechire": "transmission",
    "starter_solenoid_worn": "demarrage_charge",
    "thermostat_stuck_closed": "refroidissement",
    "thermostat_stuck_open": "refroidissement",
    "volant_moteur_bimasse_hs": "embrayage",
    "water_pump_failing": "refroidissement"
  },
  "generated_at": "2026-10-06T02:26:22Z",
  "symptoms": {
    "ampoule_grille_frequemment": "eclairage",
    "battery_drains_overnight": "demarrage_charge",
    "battery_warning_light": "demarrage_charge",
    "brake_noise_grinding": "freinage",
    "brake_noise_metallic": "freinage",
    "brake_pulling_side": "freinage",
    "brake_soft_pedal": "freinage",
    "brake_vibration_pedal": "freinage",
    "bruit_claquement_moteur": "distribution",
    "bruit_compresseur_clim": "climatisation",
    "bruit_debrayage": "embrayage",
    "bruit_direction": "direction",
    "bruit_echappement_fort": "echappement",
    "bruits_suspension": "suspension",
    "chauffage_defaillant": "climatisation",
    "claquement_virage_transmission": "transmission",
    "claquements_sourds": "suspension",
    "clim_pas_de_froid": "climatisation",
    "coolant_leak_visible": "refroidissement",
    "craquement_passage_vitesse": "transmission",
    "demarrage_difficile_injection": "injection",
    "difficulte_passage_vitesses": "embrayage",
    "direction_lourde": "direction",
    "engine_slow_warmup": "refroidissement",
    "feu_hs": "eclairage",
    "fuite_huile_boite": "transmission",
    "fuite_liquide_da": "direction",
    "fumee_anormale": "echappement",
    "fumee_noire_injection": "injection",
    "heater_weak": "refroidissement",
    "jeu_volant": "direction",
    "moteur_broute": "injection",
    "odeur_clim": "climatisation",
    "odeur_gaz_habitacle": "echappement",
    "odeur_habitacle": "filtration",
    "patinage_embrayage": "embrayage",
    "pedale_embrayage_dure": "embrayage",
    "pedale_molle_spongieuse": "embrayage",
    "perte_puissance_distribution": "distribution",
    "perte_puissance_echappement": "echappement",
    "perte_puissance_filtration": "filtration",
    "perte_puissance_injection": "injection",
    "phare_faible": "eclairage",
    "ralenti_instable": "injection",
    "rebonds_excessifs": "suspension",
    "reglage_phare_incorrect": "eclairage",
    "sifflement_demarrage": "distribution",
    "start_click_no_crank": "demarrage_charge",
    "start_cold_only": "demarrage_charge",
    "start_cranks_no_fire": "demarrage_charge",
    "start_nothing_happens": "demarrage_charge",
    "start_slow_crank": "demarrage_charge",
    "surconsommation_carburant": "filtration",
    "temoin_moteur_distribution": "distribution",
    "temp_gauge_unstable": "refroidissement",
    "temp_rises_fast": "refroidissement",
    "temp_warning_light": "refroidissement",
    "tenue_route_degradee": "suspension",
    "usure_pneus_anormale": "suspension",
    "vehicule_affaisse": "suspension",
    "vibration_acceleration": "transmission",
    "voyant_huile": "filtration"
  },
  "systems": [
    "climatisation",
    "demarrage_charge",
    "direction",
    "distribution",
    "echappement",
    "eclairage",
    "embrayage",
    "filtration",
    "freinage",
    "injection",
    "refroidissement",
    "suspension",
    "transmission"
  ],
  "version": "1.1.0"
}
